{"build_ir_sha256":"76dfe4de03ed335dbb21b04cabacdb0bac28a078637069e343193bf144cacdd0","build_spec_sha256":"20e1119cc06d0bfb1a40996f2e635d1d86d44ea17a1644c05d7a89cec255a7d7","checks":[{"evidence_views":["front","back","left","right","top","isometric","layers"],"findings":[],"id":"canonical_preview_integrity","required":true,"severity":"info","status":"PASS","summary":"All canonical C8 offline preview artifacts are safe and bound to the exact Build IR."},{"evidence_views":["front","back","left","right","top","isometric"],"findings":[],"id":"silhouette_readability","required":true,"severity":"info","status":"PASS","summary":"Canonical offline views show a clear pavilion silhouette with an unambiguous roof, platform, and corner supports."},{"evidence_views":["front","back","left","right","top","isometric"],"findings":[],"id":"proportion","required":true,"severity":"info","status":"PASS","summary":"The diagnostic massing is proportionally coherent with the compact open-pavilion brief across all orthographic and isometric views."},{"evidence_views":["front","back","left","right","top","isometric","layers"],"findings":[],"id":"material_hierarchy","required":true,"severity":"info","status":"PASS","summary":"The canonical state-color evidence consistently distinguishes the stone-brick platform, oak-log supports, and oak-plank roof without claiming runtime texture fidelity."},{"evidence_views":["front","back","left","right","top","isometric"],"findings":[],"id":"repetition","required":true,"severity":"info","status":"PASS","summary":"Repeated elements are regular and symmetric in the offline previews, consistent with the pavilion structure rather than visually accidental duplication."},{"evidence_views":["front","back","left","right","isometric"],"findings":[],"id":"facade_readability","required":true,"severity":"info","status":"PASS","summary":"All four diagnostic facades read as open bays framed by corner supports between the platform and roof."},{"evidence_views":["top","isometric","layers"],"findings":[],"id":"interior_density","required":true,"severity":"info","status":"PASS","summary":"The layer and isometric evidence shows an intentionally open, low-density interior beneath the roof; this does not assert semantic satisfaction of named spaces."},{"evidence_views":[],"findings":[],"id":"runtime_visual_fidelity","required":false,"severity":"info","status":"DEFERRED","summary":"Minecraft runtime visual fidelity is outside C8 and remains deferred to C12 runtime evidence."}],"content_sha256":"0dc3c51d23452aebd963fd466ee2fc1f5f2ceb296411772621cc1c8d095ee6ff","metrics":{"facade_depth":[{"adjacent_depth_transition_count":0,"adjacent_visible_pair_count":20,"depth_range":0,"distinct_visible_depth_count":1,"id":"front","maximum_visible_depth":0,"minimum_visible_depth":0,"transition_ratio":{"denominator":1,"numerator":0}},{"adjacent_depth_transition_count":0,"adjacent_visible_pair_count":20,"depth_range":0,"distinct_visible_depth_count":1,"id":"back","maximum_visible_depth":6,"minimum_visible_depth":6,"transition_ratio":{"denominator":1,"numerator":0}},{"adjacent_depth_transition_count":0,"adjacent_visible_pair_count":20,"depth_range":0,"distinct_visible_depth_count":1,"id":"left","maximum_visible_depth":0,"minimum_visible_depth":0,"transition_ratio":{"denominator":1,"numerator":0}},{"adjacent_depth_transition_count":0,"adjacent_visible_pair_count":20,"depth_range":0,"distinct_visible_depth_count":1,"id":"right","maximum_visible_depth":6,"minimum_visible_depth":6,"transition_ratio":{"denominator":1,"numerator":0}}],"layers":{"level_count":5,"levels":[{"density":{"denominator":1,"numerator":1},"footprint_area":49,"occupied_cells":49,"palette_counts":[{"count":0,"state":"minecraft:oak_log[axis=y]"},{"count":0,"state":"minecraft:oak_planks"},{"count":49,"state":"minecraft:stone_bricks"}],"y":0},{"density":{"denominator":49,"numerator":4},"footprint_area":49,"occupied_cells":4,"palette_counts":[{"count":4,"state":"minecraft:oak_log[axis=y]"},{"count":0,"state":"minecraft:oak_planks"},{"count":0,"state":"minecraft:stone_bricks"}],"y":1},{"density":{"denominator":49,"numerator":4},"footprint_area":49,"occupied_cells":4,"palette_counts":[{"count":4,"state":"minecraft:oak_log[axis=y]"},{"count":0,"state":"minecraft:oak_planks"},{"count":0,"state":"minecraft:stone_bricks"}],"y":2},{"density":{"denominator":49,"numerator":4},"footprint_area":49,"occupied_cells":4,"palette_counts":[{"count":4,"state":"minecraft:oak_log[axis=y]"},{"count":0,"state":"minecraft:oak_planks"},{"count":0,"state":"minecraft:stone_bricks"}],"y":3},{"density":{"denominator":1,"numerator":1},"footprint_area":49,"occupied_cells":49,"palette_counts":[{"count":0,"state":"minecraft:oak_log[axis=y]"},{"count":49,"state":"minecraft:oak_planks"},{"count":0,"state":"minecraft:stone_bricks"}],"y":4}],"maximum_occupied_cells":49,"median_middle_pair":[4,4],"minimum_occupied_cells":4},"occupancy":{"full_bounds_density":{"denominator":49,"numerator":22},"occupied_block_count":110,"occupied_bounding_box_volume":245,"occupied_density":{"denominator":49,"numerator":22},"occupied_extent":{"x":7,"y":5,"z":7},"occupied_max":{"x":6,"y":4,"z":6},"occupied_min":{"x":0,"y":0,"z":0},"palette_state_count":3},"palette_distribution":[{"fraction":{"denominator":55,"numerator":6},"occupied_block_count":12,"roles":[],"state":"minecraft:oak_log[axis=y]","visible_counts":{"back":6,"front":6,"left":6,"right":6,"top":0}},{"fraction":{"denominator":110,"numerator":49},"occupied_block_count":49,"roles":[],"state":"minecraft:oak_planks","visible_counts":{"back":7,"front":7,"left":7,"right":7,"top":49}},{"fraction":{"denominator":110,"numerator":49},"occupied_block_count":49,"roles":[],"state":"minecraft:stone_bricks","visible_counts":{"back":7,"front":7,"left":7,"right":7,"top":0}}],"projections":[{"aspect_ratio":{"denominator":5,"numerator":7},"bounding_height":5,"bounding_width":7,"component_count":1,"dominant_component_size":20,"id":"front","occupancy_ratio":{"denominator":7,"numerator":4},"occupied_cell_count":20},{"aspect_ratio":{"denominator":5,"numerator":7},"bounding_height":5,"bounding_width":7,"component_count":1,"dominant_component_size":20,"id":"back","occupancy_ratio":{"denominator":7,"numerator":4},"occupied_cell_count":20},{"aspect_ratio":{"denominator":5,"numerator":7},"bounding_height":5,"bounding_width":7,"component_count":1,"dominant_component_size":20,"id":"left","occupancy_ratio":{"denominator":7,"numerator":4},"occupied_cell_count":20},{"aspect_ratio":{"denominator":5,"numerator":7},"bounding_height":5,"bounding_width":7,"component_count":1,"dominant_component_size":20,"id":"right","occupancy_ratio":{"denominator":7,"numerator":4},"occupied_cell_count":20},{"aspect_ratio":{"denominator":1,"numerator":1},"bounding_height":7,"bounding_width":7,"component_count":1,"dominant_component_size":49,"id":"top","occupancy_ratio":{"denominator":1,"numerator":1},"occupied_cell_count":49}],"repetition":[{"distinct_column_signature_count":2,"distinct_row_signature_count":3,"id":"front","longest_adjacent_identical_column_run":5,"longest_adjacent_identical_row_run":3,"repeated_column_ratio":{"denominator":7,"numerator":5},"repeated_column_signature_count":5,"repeated_row_ratio":{"denominator":5,"numerator":2},"repeated_row_signature_count":2},{"distinct_column_signature_count":2,"distinct_row_signature_count":3,"id":"back","longest_adjacent_identical_column_run":5,"longest_adjacent_identical_row_run":3,"repeated_column_ratio":{"denominator":7,"numerator":5},"repeated_column_signature_count":5,"repeated_row_ratio":{"denominator":5,"numerator":2},"repeated_row_signature_count":2},{"distinct_column_signature_count":2,"distinct_row_signature_count":3,"id":"left","longest_adjacent_identical_column_run":5,"longest_adjacent_identical_row_run":3,"repeated_column_ratio":{"denominator":7,"numerator":5},"repeated_column_signature_count":5,"repeated_row_ratio":{"denominator":5,"numerator":2},"repeated_row_signature_count":2},{"distinct_column_signature_count":2,"distinct_row_signature_count":3,"id":"right","longest_adjacent_identical_column_run":5,"longest_adjacent_identical_row_run":3,"repeated_column_ratio":{"denominator":7,"numerator":5},"repeated_column_signature_count":5,"repeated_row_ratio":{"denominator":5,"numerator":2},"repeated_row_signature_count":2},{"distinct_column_signature_count":1,"distinct_row_signature_count":1,"id":"top","longest_adjacent_identical_column_run":7,"longest_adjacent_identical_row_run":7,"repeated_column_ratio":{"denominator":7,"numerator":6},"repeated_column_signature_count":6,"repeated_row_ratio":{"denominator":7,"numerator":6},"repeated_row_signature_count":6}]},"overall_status":"PASS","palette_resolution_sha256":null,"renderer_version":"c8-svg-v1","review_evidence_sha256":"c40de45d0f1edccfde355dc614935ce274f4ad8fd7751ec63cb2f0003ab94493","schema_version":1,"structural_report_sha256":null,"views":[{"artifact_name":"front.svg","byte_length":1443,"evidence_class":"canonical_offline_preview","height":112,"id":"front","media_type":"image/svg+xml","sha256":"18d755b33d578d293caa97230810a20084d2479629b8292398b8c01e63221d53","width":144},{"artifact_name":"back.svg","byte_length":1442,"evidence_class":"canonical_offline_preview","height":112,"id":"back","media_type":"image/svg+xml","sha256":"9c888f08ab2c4e197a29d7a3d2040bec7dbb03d7ce7e330a4e865e4f4a10e121","width":144},{"artifact_name":"left.svg","byte_length":1442,"evidence_class":"canonical_offline_preview","height":112,"id":"left","media_type":"image/svg+xml","sha256":"405f269b32f3e15e345ca9233b7d6104dd4c53bb10f0acde9524b87216ffb090","width":144},{"artifact_name":"right.svg","byte_length":1443,"evidence_class":"canonical_offline_preview","height":112,"id":"right","media_type":"image/svg+xml","sha256":"aaae71f4d68580d3b7fd8490165f48a0765fc6b46e2a55ce087fbb409769c436","width":144},{"artifact_name":"top.svg","byte_length":3190,"evidence_class":"canonical_offline_preview","height":144,"id":"top","media_type":"image/svg+xml","sha2